price,typology,area_m2,location,price_per_m2,url,amenities,description,furnished,balcony,terrace,ac,elevator,parking,kitchen_equipped,renovated,bills_included,bathrooms,bedrooms,value_score,coords,distance_to_work_km,distance_to_school_km,distance_score,total_score
660,T0,15,,44.0,https://www.idealista.pt/imovel/31376270/,[],"Água e luz incluido /! \ só para 1 pessoa /! \ NÃO SERVE PARA CASAL!AGÊNCIA/CONSULTOR IMOBILIÁRIO NÃOBairro do alvito, junto ao teatro da lanterna mágica. Veja a localização pois não está no centro de Alcântara. Estudio com cozinha microondas, placa de indução, frigorífico e compartimento para gelo, máquina de lavar a roupa, máquina de lavar a loiça, 1 casa de banho com 1WC, 1 duche e 1 lavatório. O estacionamento aqui é gratuito e com um miradouro muito bonito sobre o Tejo.Água e luz incluído n",False,False,False,True,,True,False,False,False,1.0,,22.0,,,,0.0,22.0
950,T0,25,"Rua Giovanni Antinori, 1, Rio Seco - Casalinho, Ajuda",38.0,https://www.idealista.pt/imovel/30786570/,[],"T0 situado na Ajuda, mesmo junto ao Miradouro da Ajuda. Inserido em edifício recente, apresenta bons acabamentos e encontra-se em excelente estado de conservação. O apartamento, com 25m², dispõe de frigorífico, fogão, exaustor, forno/micro-ondas, máquina de lavar loiça e casa de banho com banheira. Inclui ainda lugar de garagem e arrecadação. Disponível para arrendamento no início de Janeiro 2026.",False,False,False,False,,True,False,False,False,,,22.0,,,,0.0,22.0
800,T0,25,"Rua Amadeu de Sousa Cardoso, s/n, Alto de Santo Amaro, Alcântara",32.0,https://www.idealista.pt/imovel/34822424/,[],"Apartamento T0 situado no 2º andar de um prédio sem elevador, na Rua Amadeo de Sousa Cardoso, em Alcântara.Uma oportunidade única para quem procura viver próximo do Tejo e da zona ribeirinha, ideal para passeios, cafés e momentos de lazer à beira do rio. A zona é rica em cultura, com galerias, espaços criativos e eventos que caracterizam a vida urbana de Alcântara.Próximo de comércio local, restaurantes, bares, cafés e serviços essenciais.Fácil acesso a transportes públicos (autocarros, eléctric",False,False,False,False,False,False,False,False,False,,,18.0,,,,0.0,18.0
800,T0,25,"Rua Amadeu de Sousa Cardoso, s/n, Alto de Santo Amaro, Alcântara",32.0,https://www.idealista.pt/imovel/34822424/,[],"Apartamento T0 situado no 2º andar de um prédio sem elevador, na Rua Amadeo de Sousa Cardoso, em Alcântara.Uma oportunidade única para quem procura viver próximo do Tejo e da zona ribeirinha, ideal para passeios, cafés e momentos de lazer à beira do rio. A zona é rica em cultura, com galerias, espaços criativos e eventos que caracterizam a vida urbana de Alcântara.Próximo de comércio local, restaurantes, bares, cafés e serviços essenciais.Fácil acesso a transportes públicos (autocarros, eléctric",False,False,False,False,False,False,False,False,False,,,18.0,,,,0.0,18.0
870,T0,10,,87.0,https://www.idealista.pt/imovel/34746289/,[],"Bem-vindo a este encantador estúdio situado na pitoresca zona de Lisboa. Totalmente mobilado e cuidadosamente equipado com comodidades como cozinha com forno e serviços incluídos, como água, eletricidade, gás e Wi-Fi, o imóvel acolhe estudantes Erasmus e profissionais. Além disso, o apartamento inclui uma varanda, o que torna a sua experiência de vida ainda melhor. A equipa da Spotahome verificou pessoalmente este imóvel, garantindo que cumpre os padrões de qualidade.Localizado em Lisboa, o estú",True,True,False,False,,False,False,False,False,,,13.0,,,,0.0,13.0
760,T0,11,,69.0909090909091,https://www.idealista.pt/imovel/33115927/,[],"O teu espaço em Lisboa começa aqui.Este estúdio moderno na Nido Ajuda oferece-te tudo o que precisas para viver uma experiência equilibrada, entre estudo, lazer e a vida na cidade.O teu estúdio:Totalmente mobilado, com casa de banho privada e cozinha equipada, o espaço é só teu — ideal para quem procura independência e conforto. A internet de alta velocidade está incluída, tal como todas as contas, para que possas focar-te no que realmente importa.Na Nido Ajuda:Tudo foi pensado para facilitar o ",True,False,False,False,,False,True,False,False,,,11.0,,,,0.0,11.0
1173,T0,24,,48.875,https://www.idealista.pt/imovel/34806511/,[],"RESERVAS E PEDIDOS DE INFORMAÇÃOPara obter informações detalhadas e reservar online, clique abaixo do mapa em “Link Adicional”.TERMOS E CONDIÇÕES DE ALOJAMENTO:- Data de Disponibilidade: 01/07/2026- Duração Mínima de Aluguer: 28 dias- Número Máximo de Hóspedes: 2- Todas as Despesas Incluídas: Sim, para mais informações visite o site- Adicional:- Animais de Estimação Não Permitido- Fumadores Não PermitidoDETALHES DA PROPRIEDADEEstúdio- Descrição da Propriedade na Uniplaces: Horário e valores de c",False,False,False,False,,False,False,False,True,,,9.125,,,,0.0,9.125
